url,date,heading,desc,cat,author,keyword,last_update,needs_fixing,published
2020/12/whatsapp,15/12/2020,Srishti '23: Unwrapped,"Text Data of 20,000+ messages in the Srishti '23 Whatsapp group, visualized.",data,aman,"r, whatsapp",05/09/2021,FALSE,TRUE
2020/10/manifesto,18/10/2020,A Critical News Consumer's Starter Manifesto,"4.5 Lakh tweets by three major Indian news channels, analysed.",data,"aman, malay","r, python,news,twitter",21/09/2021,TRUE,TRUE
2021/08/abstracts,16/08/2021,This Studio Looks at Bellybuttons...,Generating design school courses for anything with GPT-3,"humour, nlp",aman,"python, ai, nlp",16/08/2021,FALSE,TRUE
2021/10/food-apps,9/10/2021,The People in the Food Apps,Examining food delivery platforms & how much they can earn you,data,aman,"r, research, modelling",9/10/2021,TRUE,TRUE
2021/12/desidata,10/12/2021,Desidata Package for R,This is a description,"data, r, open source,",aman,"r, data, development",12/12/2021,FALSE,TRUE